[
  {
    "record_id": "tel_001",
    "timestamp_utc": "2026-07-07T11:00:00Z",
    "tenant_id": "tenant_alpha",
    "workspace_id": "workspace_main",
    "project_id": "project_river_demo",
    "chain_id": "chain_ghost_caveman_001",
    "correlation_id": "inc_style_alpha_001",
    "command_type": "/style chain",
    "pipeline_name": "ghost_to_caveman",
    "handler": "ghost_apply",
    "stage": "ghost",
    "agent": "ghost",
    "latency_ms": 920,
    "queue_wait_ms": 40,
    "execution_ms": 880,
    "status": "completed",
    "profile_id": "profile_noir",
    "profile_tier": "pro",
    "cache_state": "warm",
    "registry_schema_version": "1.1.0",
    "migration_applied": false,
    "validation_failed": false,
    "unsupported_registry_blocked": false,
    "rollback_applied": false,
    "runtime_version": "rivereditor_0.1.0",
    "platform": "shell"
  },
  {
    "record_id": "tel_002",
    "timestamp_utc": "2026-07-07T11:00:01Z",
    "tenant_id": "tenant_alpha",
    "workspace_id": "workspace_main",
    "project_id": "project_river_demo",
    "chain_id": "chain_ghost_caveman_001",
    "correlation_id": "inc_style_alpha_001",
    "command_type": "/style chain",
    "pipeline_name": "ghost_to_caveman",
    "handler": "caveman_rewrite",
    "stage": "caveman",
    "agent": "caveman",
    "latency_ms": 1480,
    "queue_wait_ms": 75,
    "execution_ms": 1405,
    "status": "completed",
    "profile_id": "profile_noir",
    "profile_tier": "pro",
    "cache_state": "warm",
    "registry_schema_version": "1.1.0",
    "migration_applied": false,
    "validation_failed": false,
    "unsupported_registry_blocked": false,
    "rollback_applied": false,
    "runtime_version": "rivereditor_0.1.0",
    "platform": "shell"
  },
  {
    "record_id": "tel_003",
    "timestamp_utc": "2026-07-07T11:00:03Z",
    "tenant_id": "tenant_alpha",
    "workspace_id": "workspace_main",
    "project_id": "project_river_demo",
    "chain_id": "chain_ghost_caveman_001",
    "correlation_id": "inc_style_alpha_001",
    "command_type": "/style chain",
    "pipeline_name": "ghost_to_caveman",
    "handler": "proofread_run",
    "stage": "proofread",
    "agent": "editor",
    "latency_ms": 760,
    "queue_wait_ms": 25,
    "execution_ms": 735,
    "status": "completed",
    "profile_id": "profile_noir",
    "profile_tier": "pro",
    "cache_state": "warm",
    "registry_schema_version": "1.1.0",
    "migration_applied": false,
    "validation_failed": false,
    "unsupported_registry_blocked": false,
    "rollback_applied": false,
    "runtime_version": "rivereditor_0.1.0",
    "platform": "shell"
  },
  {
    "record_id": "tel_004",
    "timestamp_utc": "2026-07-07T11:05:00Z",
    "tenant_id": "tenant_beta",
    "workspace_id": "workspace_ops",
    "project_id": "project_release_audit",
    "chain_id": "chain_release_002",
    "correlation_id": "inc_style_beta_001",
    "command_type": "/pipeline release",
    "pipeline_name": "release",
    "handler": "registry_validate",
    "stage": "registry_validation",
    "agent": "release",
    "latency_ms": 310,
    "queue_wait_ms": 15,
    "execution_ms": 295,
    "status": "blocked",
    "profile_id": "profile_enterprise",
    "profile_tier": "enterprise",
    "cache_state": "cold",
    "registry_schema_version": "2.0.0",
    "migration_applied": false,
    "validation_failed": true,
    "unsupported_registry_blocked": true,
    "rollback_applied": false,
    "runtime_version": "rivereditor_0.1.0",
    "platform": "ui"
  },
  {
    "record_id": "tel_005",
    "timestamp_utc": "2026-07-07T11:06:00Z",
    "tenant_id": "tenant_alpha",
    "workspace_id": "workspace_main",
    "project_id": "project_river_demo",
    "chain_id": "chain_ghost_caveman_003",
    "correlation_id": "inc_style_alpha_003",
    "command_type": "/style chain",
    "pipeline_name": "ghost_to_caveman",
    "handler": "caveman_rewrite",
    "stage": "caveman",
    "agent": "caveman",
    "latency_ms": 4930,
    "queue_wait_ms": 120,
    "execution_ms": 4810,
    "status": "rolled_back",
    "profile_id": "profile_noir",
    "profile_tier": "pro",
    "cache_state": "cold",
    "registry_schema_version": "1.0.0",
    "migration_applied": true,
    "validation_failed": false,
    "unsupported_registry_blocked": false,
    "rollback_applied": true,
    "runtime_version": "rivereditor_0.1.0",
    "platform": "shell"
  }
]
